{
  "$schema": "https://json-schema.org/draft/2020-12/schema",
  "title": "Build Report",
  "type": "object",
  "required": ["concept", "version", "status", "audits", "counts"],
  "properties": { "concept": { "type": "string" }, "version": { "type": "string" }, "status": { "type": "string", "enum": ["published", "blocked"] }, "audits": { "type": "object" }, "counts": { "type": "object" } }
}
